book,chapter,verse,text,cluster
Mark,11,24,"Therefore I say unto you, What things soever ye desire, when ye pray, believe that ye receive them, and ye shall have them.",30
Mark,11,25,"And when ye stand praying, forgive, if ye have ought against any: that your Father also which is in heaven may forgive you your trespasses.",39
Mark,11,26,"But if ye do not forgive, neither will your Father which is in heaven forgive your trespasses.",39
Mark,11,29,"I will also ask of you one question, and answer me, and I will tell you by what authority I do these things.",1
Mark,11,30,"The baptism of John, was it from heaven, or of men?",20
Mark,11,30,answer me.,11
Mark,11,33,Neither do I tell you by what authority I do these things.,1
Mark,12,1,"A certain man planted a vineyard, and set an hedge about it, and digged a place for the winefat, and built a tower, and let it out to husbandmen, and went into a far country.",13
Mark,12,2,"And at the season he sent to the husbandmen a servant, that he might receive from the husbandmen of the fruit of the vineyard.",47
Mark,12,3,"And they caught him, and beat him, and sent him away empty.",13
Mark,12,4,"And again he sent unto them another servant; and at him they cast stones, and wounded him in the head, and sent him away shamefully handled.",47
Mark,12,5,"And again he sent another; and him they killed, and many others; beating some, and killing some.",47
Mark,12,6,"Having yet therefore one son, his wellbeloved, he sent him also last unto them, saying, They will reverence my son.",8
Mark,12,7,"But those husbandmen said among themselves, This is the heir; come, let us kill him, and the inheritance shall be our's.",13
Mark,12,8,"And they took him, and killed him, and cast him out of the vineyard.",13
Mark,12,9,What shall therefore the lord of the vineyard do?,8
Mark,12,9,"he will come and destroy the husbandmen, and will give the vineyard unto others.",47
Mark,12,10,And have ye not read this scripture; The stone which the builders rejected is become the head of the corner:,10
Mark,12,11,"This was the Lord's doing, and it is marvellous in our eyes?",20
Mark,12,15,Why tempt ye me?,3
Mark,12,15,"bring me a penny, that I may see it.",10
Mark,12,16,Whose is this image and superscription?,20
Mark,12,17,"Render to Caesar the things that are Caesar's, and to God the things that are God's.",43
Mark,12,24,"Do ye not therefore err, because ye know not the scriptures, neither the power of God?",3
Mark,12,25,"For when they shall rise from the dead, they neither marry, nor are given in marriage; but are as the angels which are in heaven.",43
Mark,12,26,"And as touching the dead, that they rise: have ye not read in the book of Moses, how in the bush God spake unto him, saying, I am the God of Abraham, and the God of Isaac, and the God of Jacob?",34
Mark,12,27,"He is not the God of the dead, but the God of the living: ye therefore do greatly err.",34
Mark,12,29,"The first of all the commandments is, Hear, O Israel; The Lord our God is one Lord:",10
Mark,12,30,"And thou shalt love the Lord thy God with all thy heart, and with all thy soul, and with all thy mind, and with all thy strength: this is the first commandment.",46
Mark,12,31,"And the second is like, namely this, Thou shalt love thy neighbour as thyself.",46
Mark,12,31,There is none other commandment greater than these.,10
Mark,12,34,Thou art not far from the kingdom of God.,22
Mark,12,35,How say the scribes that Christ is the son of David?,5
Mark,12,36,"For David himself said by the Holy Ghost, The LORD said to my Lord, Sit thou on my right hand, till I make thine enemies thy footstool.",17
Mark,12,37,David therefore himself calleth him Lord; and whence is he then his son?,8
Mark,12,38,"Beware of the scribes, which love to go in long clothing, and love salutations in the marketplaces,",10
Mark,12,39,"And the chief seats in the synagogues, and the uppermost rooms at feasts:",10
Mark,12,40,"Which devour widows' houses, and for a pretence make long prayers: these shall receive greater damnation.",10
Mark,12,43,"Verily I say unto you, That this poor widow hath cast more in, than all they which have cast into the treasury:",2
Mark,12,44,"For all they did cast in of their abundance; but she of her want did cast in all that she had, even all her living.",10
Mark,13,2,Seest thou these great buildings?,17
Mark,13,2,"there shall not be left one stone upon another, that shall not be thrown down.",19
Mark,13,5,Take heed lest any man deceive you:,10
Mark,13,6,"For many shall come in my name, saying, I am Christ; and shall deceive many.",8
Mark,13,7,"And when ye shall hear of wars and rumours of wars, be ye not troubled: for such things must needs be; but the end shall not be yet.",10
Mark,13,8,"For nation shall rise against nation, and kingdom against kingdom: and there shall be earthquakes in divers places, and there shall be famines and troubles: these are the beginnings of sorrows.",40
Mark,13,9,"But take heed to yourselves: for they shall deliver you up to councils; and in the synagogues ye shall be beaten: and ye shall be brought before rulers and kings for my sake, for a testimony against them.",30
Mark,13,10,And the gospel must first be published among all nations.,10
Mark,13,11,"But when they shall lead you, and deliver you up, take no thought beforehand what ye shall speak, neither do ye premeditate: but whatsoever shall be given you in that hour, that speak ye: for it is not ye that speak, but the Holy Ghost.",30
Mark,13,12,"Now the brother shall betray the brother to death, and the father the son; and children shall rise up against their parents, and shall cause them to be put to death.",47
Mark,13,13,"And ye shall be hated of all men for my name's sake: but he that shall endure unto the end, the same shall be saved.",19
Mark,13,14,"But when ye shall see the abomination of desolation, spoken of by Daniel the prophet, standing where it ought not, (let him that readeth understand,) then let them that be in Judaea flee to the mountains:",10
Mark,13,15,"And let him that is on the housetop not go down into the house, neither enter therein, to take any thing out of his house:",13
Mark,13,16,And let him that is in the field not turn back again for to take up his garment.,13
Mark,13,17,"But woe to them that are with child, and to them that give suck in those days!",6
Mark,13,18,And pray ye that your flight be not in the winter.,10
Mark,13,19,"For in those days shall be affliction, such as was not from the beginning of the creation which God created unto this time, neither shall be.",10
Mark,13,20,"And except that the Lord had shortened those days, no flesh should be saved: but for the elect's sake, whom he hath chosen, he hath shortened the days.",47
Mark,13,21,"And then if any man shall say to you, Lo, here is Christ; or, lo, he is there; believe him not:",20
Mark,13,22,"For false Christs and false prophets shall rise, and shall shew signs and wonders, to seduce, if it were possible, even the elect.",47
Mark,13,23,"But take ye heed: behold, I have foretold you all things.",30
Mark,13,24,"But in those days, after that tribulation, the sun shall be darkened, and the moon shall not give her light,",10
Mark,13,25,"And the stars of heaven shall fall, and the powers that are in heaven shall be shaken.",43
Mark,13,26,And then shall they see the Son of man coming in the clouds with great power and glory.,5
Mark,13,27,"And then shall he send his angels, and shall gather together his elect from the four winds, from the uttermost part of the earth to the uttermost part of heaven.",47
Mark,13,28,"Now learn a parable of the fig tree; When her branch is yet tender, and putteth forth leaves, ye know that summer is near:",49
Mark,13,29,"So ye in like manner, when ye shall see these things come to pass, know that it is nigh, even at the doors.",1
Mark,13,30,"Verily I say unto you, that this generation shall not pass, till all these things be done.",24
Mark,13,31,Heaven and earth shall pass away: but my words shall not pass away.,48
Mark,13,32,"But of that day and that hour knoweth no man, no, not the angels which are in heaven, neither the Son, but the Father.",38
Mark,13,33,"Take ye heed, watch and pray: for ye know not when the time is.",30
Mark,13,34,"For the Son of Man is as a man taking a far journey, who left his house, and gave authority to his servants, and to every man his work, and commanded the porter to watch.",5
Mark,13,35,"Watch ye therefore: for ye know not when the master of the house cometh, at even, or at midnight, or at the cockcrowing, or in the morning:",10
Mark,13,36,Lest coming suddenly he find you sleeping.,10
Mark,13,37,"And what I say unto you I say unto all, Watch.",2
Mark,14,6,Let her alone; why trouble ye her?,3
Mark,14,6,she hath wrought a good work on me.,10
Mark,14,7,"For ye have the poor with you always, and whensoever ye will ye may do them good: but me ye have not always.",30
Mark,14,8,She hath done what she could: she is come aforehand to anoint my body to the burying.,10
Mark,14,9,"Verily I say unto you, Wheresoever this gospel shall be preached throughout the whole world, this also that she hath done shall be spoken of for a memorial of her.",2
Mark,14,13,"Go ye into the city, and there shall meet you a man bearing a pitcher of water: follow him.",47
Mark,14,14,"And wheresoever he shall go in, say ye to the goodman of the house, The Master saith, Where is the guestchamber, where I shall eat the passover with my disciples?",10
Mark,14,15,And he will shew you a large upper room furnished and prepared: there make ready for us.,47
Mark,14,18,"Verily I say unto you, One of you which eateth with me shall betray me.",2
Mark,14,20,"It is one of the twelve, that dippeth with me in the dish.",10
Mark,14,21,"The Son of man indeed goeth, as it is written of him: but woe to that man by whom the Son of man is betrayed!",5
Mark,14,21,good were it for that man if he had never been born.,47
Mark,14,22,"Take, eat: this is my body.",10
Mark,14,24,"And he said unto them, This is my blood of the new testament, which is shed for many.",10
Mark,14,25,"Verily I say unto you, I will drink no more of the fruit of the vine, until that day that I drink it new in the kingdom of God.",2
Mark,14,27,"All ye shall be offended because of me this night: for it is written, I will smite the shepherd, and the sheep shall be scattered.",20
Mark,14,28,"But after that I am risen, I will go before you into Galilee.",34
Mark,14,30,"Verily I say unto thee, That this day, even in this night, before the cock crow twice, thou shalt deny me thrice.",36
Mark,14,32,"Sit ye here, while I shall pray.",30
Mark,14,34,"My soul is exceeding sorrowful unto death: tarry ye here, and watch.",10
Mark,14,36,"Abba, Father, all things are possible unto thee; take away this cup from me: nevertheless not what I will, but what thou wilt.",17
Mark,14,37,"Simon, sleepest thou?",17
Mark,14,37,couldest not thou watch one hour?,17
Mark,14,38,"Watch ye and pray, lest ye enter into temptation.",37
Mark,14,38,"The spirit truly is ready, but the flesh is weak.",10
Mark,14,41,"Sleep on now, and take your rest: it is enough, the hour is come; behold, the Son of man is betrayed into the hands of sinners.",5
Mark,14,42,"Rise up, let us go; lo, he that betrayeth me is at hand.",13
Mark,14,48,"Are ye come out, as against a thief, with swords and with staves to take me?",40
Mark,14,49,"I was daily with you in the temple teaching, and ye took me not: but the scriptures must be fulfilled.",30
Mark,14,62,"I am: and ye shall see the Son of man sitting on the right hand of power, and coming in the clouds of heaven.",5
Mark,14,72,"Before the cock crow twice, thou shalt deny me thrice.",36
Mark,15,2,Thou sayest it.,17
Mark,15,34,"My God, my God, why hast thou forsaken me?",3
Mark,16,15,"Go ye into all the world, and preach the gospel to every creature.",33
Mark,16,16,He that believeth and is baptized shall be saved; but he that believeth not shall be damned.,11
Mark,16,17,And these signs shall follow them that believe; In my name shall they cast out devils; they shall speak with new tongues;,10
Mark,16,18,"They shall take up serpents; and if they drink any deadly thing, it shall not hurt them; they shall lay hands on the sick, and they shall recover.",47
Luke,2,49,How is it that ye sought me?,20
Luke,2,49,wist ye not that I must be about my Father's business?,10
Luke,4,4,"It is written, That man shall not live by bread alone, but by every word of God.",20
Luke,4,8,"Get thee behind me, Satan: for it is written, Thou shalt worship the Lord thy God, and him only shalt thou serve.",46
Luke,4,12,"It is said, Thou shalt not tempt the Lord thy God.",46
Luke,4,18,"The Spirit of the Lord is upon me, because he hath anointed me to preach the gospel to the poor; he hath sent me to heal the brokenhearted, to preach deliverance to the captives, and recovering of sight to the blind, to set at liberty them that are bruised,",10
Luke,4,19,To preach the acceptable year of the Lord.,10
Luke,4,21,This day is this scripture fulfilled in your ears.,10
Luke,4,23,"Ye will surely say unto me this proverb, Physician, heal thyself: whatsoever we have heard done in Capernaum, do also here in thy country.",10
Luke,4,24,"Verily I say unto you, No prophet is accepted in his own country.",2
Luke,4,25,"But I tell you of a truth, many widows were in Israel in the days of Elias, when the heaven was shut up three years and six months, when great famine was throughout all the land;",10
Luke,4,26,"But unto none of them was Elias sent, save unto Sarepta, a city of Sidon, unto a woman that was a widow.",47
Luke,4,27,"And many lepers were in Israel in the time of Eliseus the prophet; and none of them was cleansed, saving Naaman the Syrian.",10
Luke,4,35,"Hold thy peace, and come out of him.",47
Luke,4,43,I must preach the kingdom of God to other cities also: for therefore am I sent.,22
Luke,5,4,"Launch out into the deep, and let down your nets for a draught.",10
Luke,5,10,Fear not; from henceforth thou shalt catch men.,17
Luke,5,13,I will: be thou clean.,17
Luke,5,14,"but go, and shew thyself to the priest, and offer for thy cleansing, according as Moses commanded, for a testimony unto them.",47
Luke,5,20,"Man, thy sins are forgiven thee.",26
Luke,5,22,What reason ye in your hearts?,3
Luke,5,23,"Whether is easier, to say, Thy sins be forgiven thee; or to say, Rise up and walk?",26
Luke,5,24,"But that ye may know that the Son of man hath power upon earth to forgive sins, I say unto thee, Arise, and take up thy couch, and go into thine house.",5
Luke,5,27,Follow me.,14
Luke,5,31,They that are whole need not a physician; but they that are sick.,43
Luke,5,32,"I came not to call the righteous, but sinners to repentance.",10
Luke,5,34,"Can ye make the children of the bridechamber fast, while the bridegroom is with them?",0
Luke,5,35,"But the days will come, when the bridegroom shall be taken away from them, and then shall they fast in those days.",0
Luke,5,36,"No man putteth a piece of a new garment upon an old; if otherwise, then both the new maketh a rent, and the piece that was taken out of the new agreeth not with the old.",47
Luke,5,37,"And no man putteth new wine into old bottles; else the new wine will burst the bottles, and be spilled, and the bottles shall perish.",47
Luke,5,38,But new wine must be put into new bottles; and both are preserved.,47
Luke,5,39,"No man also having drunk old wine straightway desireth new: for he saith, The old is better.",10
Luke,6,3,"Have ye not read so much as this, what David did, when himself was an hungred, and they which were with him;",47
Luke,6,4,"How he went into the house of God, and did take and eat the shewbread, and gave also to them that were with him; which it is not lawful to eat but for the priests alone?",47
Luke,6,5,That the Son of man is Lord also of the sabbath.,5
Luke,6,8,"Rise up, and stand forth in the midst.",49
Luke,6,9,"I will ask you one thing; Is it lawful on the sabbath days to do good, or to do evil?",44
Luke,6,9,"to save life, or to destroy it?",20
Luke,6,10,Stretch forth thy hand.,49
Luke,6,20,Blessed be ye poor: for yours is the kingdom of God.,22
Luke,6,21,Blessed are ye that hunger now: for ye shall be filled.,43
Luke,6,21,Blessed are ye that weep now: for ye shall laugh.,43
Luke,6,22,"Blessed are ye, when men shall hate you, and when they shall separate you from their company, and shall reproach you, and cast out your name as evil, for the Son of man's sake.",43
Luke,6,23,"Rejoice ye in that day, and leap for joy: for, behold, your reward is great in heaven: for in the like manner did their fathers unto the prophets.",10
Luke,6,24,But woe unto you that are rich!,6
Luke,6,24,for ye have received your consolation.,30
Luke,6,25,Woe unto you that are full!,6
Luke,6,25,for ye shall hunger.,30
Luke,6,25,Woe unto you that laugh now!,6
Luke,6,25,for ye shall mourn and weep.,30
Luke,6,26,"Woe unto you, when all men shall speak well of you!",6
Luke,6,26,for so did their fathers to the false prophets.,10
Luke,6,27,"But I say unto you which hear, Love your enemies, do good to them which hate you,",2
Luke,6,28,"Bless them that curse you, and pray for them which despitefully use you.",30
Luke,6,29,And unto him that smiteth thee on the one cheek offer also the other; and him that taketh away thy cloak forbid not to take thy coat also.,47
Luke,6,30,Give to every man that asketh of thee; and of him that taketh away thy goods ask them not again.,47
Luke,6,31,"And as ye would that men should do to you, do ye also to them likewise.",30
Luke,6,32,"For if ye love them which love you, what thank have ye?",30
Luke,6,32,for sinners also love those that love them.,10
Luke,6,33,"And if ye do good to them which do good to you, what thank have ye?",30
Luke,6,33,for sinners also do even the same.,10
Luke,6,34,"And if ye lend to them of whom ye hope to receive, what thank have ye?",30
Luke,6,34,"for sinners also lend to sinners, to receive as much again.",10
Luke,6,35,"But love ye your enemies, and do good, and lend, hoping for nothing again; and your reward shall be great, and ye shall be the children of the Highest: for he is kind unto the unthankful and to the evil.",30
Luke,6,36,"Be ye therefore merciful, as your Father also is merciful.",10
Luke,6,37,"Judge not, and ye shall not be judged: condemn not, and ye shall not be condemned: forgive, and ye shall be forgiven:",19
Luke,6,38,"Give, and it shall be given unto you; good measure, pressed down, and shaken together, and running over, shall men give into your bosom.",47
Luke,6,38,For with the same measure that ye mete withal it shall be measured to you again.,30
Luke,6,39,Can the blind lead the blind?,10
Luke,6,39,shall they not both fall into the ditch?,10
Luke,6,40,The disciple is not above his master: but every one that is perfect shall be as his master.,10
Luke,6,41,"And why beholdest thou the mote that is in thy brother's eye, but perceivest not the beam that is in thine own eye?",33
Luke,6,42,"Either how canst thou say to thy brother, Brother, let me pull out the mote that is in thine eye, when thou thyself beholdest not the beam that is in thine own eye?",33
Luke,6,42,"Thou hypocrite, cast out first the beam out of thine own eye, and then shalt thou see clearly to pull out the mote that is in thy brother's eye.",33
Luke,6,43,For a good tree bringeth not forth corrupt fruit; neither doth a corrupt tree bring forth good fruit.,49
Luke,6,44,For every tree is known by his own fruit.,49
Luke,6,44,"For of thorns men do not gather figs, nor of a bramble bush gather they grapes.",10
Luke,6,45,A good man out of the good treasure of his heart bringeth forth that which is good; and an evil man out of the evil treasure of his heart bringeth forth that which is evil: for of the abundance of the heart his mouth speaketh.,49
Luke,6,46,"And why call ye me, Lord, Lord, and do not the things which I say?",8
Luke,6,47,"Whosoever cometh to me, and heareth my sayings, and doeth them, I will shew you to whom he is like:",38
Luke,6,48,"He is like a man which built an house, and digged deep, and laid the foundation on a rock: and when the flood arose, the stream beat vehemently upon that house, and could not shake it: for it was founded upon a rock.",47
Luke,6,49,"But he that heareth, and doeth not, is like a man that without a foundation built an house upon the earth; against which the stream did beat vehemently, and immediately it fell; and the ruin of that house was great.",47
Luke,7,9,"I say unto you, I have not found so great faith, no, not in Israel.",2
Luke,7,13,Weep not.,10
Luke,7,14,"Young man, I say unto thee, Arise.",18
Luke,7,22,"Go your way, and tell John what things ye have seen and heard; how that the blind see, the lame walk, the lepers are cleansed, the deaf hear, the dead are raised, to the poor the gospel is preached.",10
Luke,7,23,"And blessed is he, whosoever shall not be offended in me.",19
Luke,7,24,What went ye out into the wilderness for to see?,35
Luke,7,24,A reed shaken with the wind?,20
Luke,7,25,But what went ye out for to see?,35
Luke,7,25,A man clothed in soft raiment?,20
Luke,7,25,"Behold, they which are gorgeously apparelled, and live delicately, are in kings' courts.",43
Luke,7,26,But what went ye out for to see?,35
Luke,7,26,A prophet?,20
Luke,7,26,"Yea, I say unto you, and much more than a prophet.",2
Luke,7,27,"This is he, of whom it is written, Behold, I send my messenger before thy face, which shall prepare thy way before thee.",20
Luke,7,28,"For I say unto you, Among those that are born of women there is not a greater prophet than John the Baptist: but he that is least in the kingdom of God is greater than he.",22
Luke,7,31,Whereunto then shall I liken the men of this generation?,20
Luke,7,31,and to what are they like?,43
Luke,7,32,"They are like unto children sitting in the marketplace, and calling one to another, and saying, We have piped unto you, and ye have not danced; we have mourned to you, and ye have not wept.",30
Luke,7,33,"For John the Baptist came neither eating bread nor drinking wine; and ye say, He hath a devil.",47
Luke,7,34,"The Son of man is come eating and drinking; and ye say, Behold a gluttonous man, and a winebibber, a friend of publicans and sinners!",5
Luke,7,35,But wisdom is justified of all her children.,10
Luke,7,40,"Simon, I have somewhat to say unto thee.",17
Luke,7,41,"There was a certain creditor which had two debtors: the one owed five hundred pence, and the other fifty.",47
Luke,7,42,"And when they had nothing to pay, he frankly forgave them both.",47
Luke,7,42,"Tell me therefore, which of them will love him most?",10
Luke,7,43,Thou hast rightly judged.,17
Luke,7,44,Seest thou this woman?,17
Luke,7,44,"I entered into thine house, thou gavest me no water for my feet: but she hath washed my feet with tears, and wiped them with the hairs of her head.",10
Luke,7,45,Thou gavest me no kiss: but this woman since the time I came in hath not ceased to kiss my feet.,10
Luke,7,46,My head with oil thou didst not anoint: but this woman hath anointed my feet with ointment.,10
Luke,7,47,"Wherefore I say unto thee, Her sins, which are many, are forgiven; for she loved much: but to whom little is forgiven, the same loveth little.",43
Luke,7,48,Thy sins are forgiven.,26
Luke,7,50,Thy faith hath saved thee; go in peace.,4
Luke,8,5,"A sower went out to sow his seed: and as he sowed, some fell by the way side; and it was trodden down, and the fowls of the air devoured it.",47
Luke,8,6,"And some fell upon a rock; and as soon as it was sprung up, it withered away, because it lacked moisture.",47
Luke,8,7,"And some fell among thorns; and the thorns sprang up with it, and choked it.",49
Luke,8,8,"And other fell on good ground, and sprang up, and bare fruit an hundredfold.",49
Luke,8,8,"He that hath ears to hear, let him hear.",12
Luke,8,10,"Unto you it is given to know the mysteries of the kingdom of God: but to others in parables; that seeing they might not see, and hearing they might not understand.",22
Luke,8,11,Now the parable is this: The seed is the word of God.,10
Luke,8,12,"Those by the way side are they that hear; then cometh the devil, and taketh away the word out of their hearts, lest they should believe and be saved.",43
Luke,8,13,"They on the rock are they, which, when they hear, receive the word with joy; and these have no root, which for a while believe, and in time of temptation fall away.",43
Luke,8,14,"And that which fell among thorns are they, which, when they have heard, go forth, and are choked with cares and riches and pleasures of this life, and bring no fruit to perfection.",43
Luke,8,15,"But that on the good ground are they, which in an honest and good heart, having heard the word, keep it, and bring forth fruit with patience.",49
Luke,8,16,"No man, when he hath lighted a candle, covereth it with a vessel, or putteth it under a bed; but setteth it on a candlestick, that they which enter in may see the light.",47
Luke,8,17,"For nothing is secret, that shall not be made manifest; neither any thing hid, that shall not be known and come abroad.",19
Luke,8,18,"Take heed therefore how ye hear: for whosoever hath, to him shall be given; and whosoever hath not, from him shall be taken even that which he seemeth to have.",11
Luke,8,21,"My mother and my brethren are these which hear the word of God, and do it.",43
Luke,8,22,Let us go over unto the other side of the lake.,13
Luke,8,22,And they launched forth.,49
Luke,8,25,Where is your faith?,20
Luke,8,30,What is thy name?,20
Luke,8,39,"Return to thine own house, and shew how great things God hath done unto thee.",47
Luke,8,45,Who touched me?,3
Luke,8,46,Somebody hath touched me: for I perceive that virtue is gone out of me.,10
Luke,8,48,"Daughter, be of good comfort: thy faith hath made thee whole; go in peace.",4
Luke,8,50,"Fear not: believe only, and she shall be made whole.",10
Luke,8,52,"Weep not; she is not dead, but sleepeth.",34
