book,chapter,verse,text,cluster
Matthew,20,2,"And when he had agreed with the labourers for a penny a day, he sent them into his vineyard.",47
Matthew,20,3,"And he went out about the third hour, and saw others standing idle in the marketplace,",47
Matthew,20,4,"And said unto them; Go ye also into the vineyard, and whatsoever is right I will give you.",30
Matthew,20,4,And they went their way.,47
Matthew,20,5,"Again he went out about the sixth and ninth hour, and did likewise.",47
Matthew,20,6,"And about the eleventh hour he went out, and found others standing idle, and saith unto them, Why stand ye here all the day idle?",47
Matthew,20,7,"They say unto him, Because no man hath hired us.",47
Matthew,20,7,"He saith unto them, Go ye also into the vineyard; and whatsoever is right, that shall ye receive.",30
Matthew,20,8,"So when even was come, the lord of the vineyard saith unto his steward, Call the labourers, and give them their hire, beginning from the last unto the first.",47
Matthew,20,9,"And when they came that were hired about the eleventh hour, they received every man a penny.",47
Matthew,20,10,"But when the first came, they supposed that they should have received more; and they likewise received every man a penny.",47
Matthew,20,11,"And when they had received it, they murmured against the goodman of the house,",47
Matthew,20,12,"Saying, These last have wrought but one hour, and thou hast made them equal unto us, which have borne the burden and heat of the day.",17
Matthew,20,13,"But he answered one of them, and said, Friend, I do thee no wrong: didst not thou agree with me for a penny?",17
Matthew,20,14,"Take that thine is, and go thy way: I will give unto this last, even as unto thee.",17
Matthew,20,15,Is it not lawful for me to do what I will with mine own?,20
Matthew,20,15,"Is thine eye evil, because I am good?",33
Matthew,20,16,"So the last shall be first, and the first last: for many be called, but few chosen.",43
Matthew,20,18,"Behold, we go up to Jerusalem; and the Son of man shall be betrayed unto the chief priests and unto the scribes, and they shall condemn him to death,",5
Matthew,20,19,"And shall deliver him to the Gentiles to mock, and to scourge, and to crucify him: and the third day he shall rise again.",47
Matthew,20,21,What wilt thou?,17
Matthew,20,22,Ye know not what ye ask.,30
Matthew,20,22,"Are ye able to drink of the cup that I shall drink of, and to be baptized with the baptism that I am baptized with?",34
Matthew,20,23,"Ye shall drink indeed of my cup, and be baptized with the baptism that I am baptized with: but to sit on my right hand, and on my left, is not mine to give, but it shall be given to them for whom it is prepared of my Father.",34
Matthew,20,25,"Ye know that the princes of the Gentiles exercise dominion over them, and they that are great exercise authority upon them.",43
Matthew,20,26,"But it shall not be so among you: but whosoever will be great among you, let him be your minister;",13
Matthew,20,27,"And whosoever will be chief among you, let him be your servant:",13
Matthew,20,28,"Even as the Son of man came not to be ministered unto, but to minister, and to give his life a ransom for many.",5
Matthew,20,32,What will ye that I shall do unto you?,30
Matthew,21,2,"Go into the village over against you, and straightway ye shall find an ass tied, and a colt with her: loose them, and bring them unto me.",30
Matthew,21,3,"And if any man say ought unto you, ye shall say, The Lord hath need of them; and straightway he will send them.",30
Matthew,21,13,"It is written, My house shall be called the house of prayer; but ye have made it a den of thieves.",20
Matthew,21,16,"Yea; have ye never read, Out of the mouth of babes and sucklings thou hast perfected praise?",17
Matthew,21,19,Let no fruit grow on thee henceforward for ever.,10
Matthew,21,21,"Verily I say unto you, If ye have faith, and doubt not, ye shall not only do this which is done to the fig tree, but also if ye shall say unto this mountain, Be thou removed, and be thou cast into the sea; it shall be done.",2
Matthew,21,22,"And all things, whatsoever ye shall ask in prayer, believing, ye shall receive.",30
Matthew,21,24,"I also will ask you one thing, which if ye tell me, I in like wise will tell you by what authority I do these things.",1
Matthew,21,25,"The baptism of John, whence was it?",20
Matthew,21,25,"from heaven, or of men?",20
Matthew,21,27,Neither tell I you by what authority I do these things.,1
Matthew,21,28,But what think ye?,3
Matthew,21,28,"A certain man had two sons; and he came to the first, and said, Son, go work to day in my vineyard.",47
Matthew,21,29,"He answered and said, I will not: but afterward he repented, and went.",47
Matthew,21,30,"And he came to the second, and said likewise.",47
Matthew,21,30,"And he answered and said, I go, sir: and went not.",47
Matthew,21,31,Whether of them twain did the will of his father?,10
Matthew,21,31,"Verily I say unto you, That the publicans and the harlots go into the kingdom of God before you.",2
Matthew,21,32,"For John came unto you in the way of righteousness, and ye believed him not: but the publicans and the harlots believed him: and ye, when ye had seen it, repented not afterward, that ye might believe him.",30
Matthew,21,33,"Hear another parable: There was a certain householder, which planted a vineyard, and hedged it round about, and digged a winepress in it, and built a tower, and let it out to husbandmen, and went into a far country:",13
Matthew,21,34,"And when the time of the fruit drew near, he sent his servants to the husbandmen, that they might receive the fruits of it.",47
Matthew,21,35,"And the husbandmen took his servants, and beat one, and killed another, and stoned another.",47
Matthew,21,36,"Again, he sent other servants more than the first: and they did unto them likewise.",47
Matthew,21,37,"But last of all he sent unto them his son, saying, They will reverence my son.",8
Matthew,21,38,"But when the husbandmen saw the son, they said among themselves, This is the heir; come, let us kill him, and let us seize on his inheritance.",13
Matthew,21,39,"And they caught him, and cast him out of the vineyard, and slew him.",13
Matthew,21,40,"When the lord therefore of the vineyard cometh, what will he do unto those husbandmen?",10
Matthew,21,42,"Did ye never read in the scriptures, The stone which the builders rejected, the same is become the head of the corner: this is the Lord's doing, and it is marvellous in our eyes?",10
Matthew,21,43,"Therefore say I unto you, The kingdom of God shall be taken from you, and given to a nation bringing forth the fruits thereof.",22
Matthew,21,44,"And whosoever shall fall on this stone shall be broken: but on whomsoever it shall fall, it will grind him to powder.",47
Matthew,22,2,"The kingdom of heaven is like unto a certain king, which made a marriage for his son,",22
Matthew,22,3,And sent forth his servants to call them that were bidden to the wedding: and they would not come.,47
Matthew,22,4,"Again, he sent forth other servants, saying, Tell them which are bidden, Behold, I have prepared my dinner: my oxen and my fatlings are killed, and all things are ready: come unto the marriage.",43
Matthew,22,5,"But they made light of it, and went their ways, one to his farm, another to his merchandise:",47
Matthew,22,6,"And the remnant took his servants, and entreated them spitefully, and slew them.",47
Matthew,22,7,"But when the king heard thereof, he was wroth: and he sent forth his armies, and destroyed those murderers, and burned up their city.",47
Matthew,22,8,"Then saith he to his servants, The wedding is ready, but they which were bidden were not worthy.",47
Matthew,22,9,"Go ye therefore into the highways, and as many as ye shall find, bid to the marriage.",30
Matthew,22,10,"So those servants went out into the highways, and gathered together all as many as they found, both bad and good: and the wedding was furnished with guests.",47
Matthew,22,11,"And when the king came in to see the guests, he saw there a man which had not on a wedding garment:",47
Matthew,22,12,"And he saith unto him, Friend, how camest thou in hither not having a wedding garment?",47
Matthew,22,12,And he was speechless.,47
Matthew,22,13,"Then said the king to the servants, Bind him hand and foot, and take him away, and cast him into outer darkness, there shall be weeping and gnashing of teeth.",29
Matthew,22,14,"For many are called, but few are chosen.",43
Matthew,22,18,"Why tempt ye me, ye hypocrites?",3
Matthew,22,19,Shew me the tribute money.,10
Matthew,22,20,Whose is this image and superscription?,20
Matthew,22,21,Render therefore unto Caesar the things which are Caesar's; and unto God the things that are God's.,43
Matthew,22,29,"Ye do err, not knowing the scriptures, nor the power of God.",10
Matthew,22,30,"For in the resurrection they neither marry, nor are given in marriage, but are as the angels of God in heaven.",43
Matthew,22,31,"But as touching the resurrection of the dead, have ye not read that which was spoken unto you by God, saying,",34
Matthew,22,32,"I am the God of Abraham, and the God of Isaac, and the God of Jacob?",34
Matthew,22,32,"God is not the God of the dead, but of the living.",34
Matthew,22,37,"Thou shalt love the Lord thy God with all thy heart, and with all thy soul, and with all thy mind.",46
Matthew,22,38,This is the first and great commandment.,10
Matthew,22,39,"And the second is like unto it, Thou shalt love thy neighbour as thyself.",46
Matthew,22,40,On these two commandments hang all the law and the prophets.,10
Matthew,22,42,What think ye of Christ?,3
Matthew,22,42,whose son is he?,20
Matthew,22,43,"He saith unto them, How then doth David in spirit call him Lord, saying,",8
Matthew,22,44,"The LORD said unto my Lord, Sit thou on my right hand, till I make thine enemies thy footstool?",17
Matthew,22,45,"If David then call him Lord, how is he his son?",8
Matthew,23,2,The scribes and the Pharisees sit in Moses' seat:,10
Matthew,23,3,"All therefore whatsoever they bid you observe, that observe and do; but do not ye after their works: for they say, and do not.",10
Matthew,23,4,"For they bind heavy burdens and grievous to be borne, and lay them on men's shoulders; but they themselves will not move them with one of their fingers.",47
Matthew,23,5,"But all their works they do for to be seen of men: they make broad their phylacteries, and enlarge the borders of their garments,",10
Matthew,23,6,"And love the uppermost rooms at feasts, and the chief seats in the synagogues,",10
Matthew,23,7,"And greetings in the markets, and to be called of men, Rabbi, Rabbi.",10
Matthew,23,8,"But be not ye called Rabbi: for one is your Master, even Christ; and all ye are brethren.",43
Matthew,23,9,"And call no man your father upon the earth: for one is your Father, which is in heaven.",39
Matthew,23,10,"Neither be ye called masters: for one is your Master, even Christ.",10
Matthew,23,11,But he that is greatest among you shall be your servant.,11
Matthew,23,12,And whosoever shall exalt himself shall be abased; and he that shall humble himself shall be exalted.,11
Matthew,23,13,"But woe unto you, scribes and Pharisees, hypocrites!",21
Matthew,23,13,"for ye shut up the kingdom of heaven against men: for ye neither go in yourselves, neither suffer ye them that are entering to go in.",22
Matthew,23,14,"Woe unto you, scribes and Pharisees, hypocrites!",21
Matthew,23,14,"for ye devour widows' houses, and for a pretence make long prayer: therefore ye shall receive the greater damnation.",10
Matthew,23,15,"Woe unto you, scribes and Pharisees, hypocrites!",21
Matthew,23,15,"for ye compass sea and land to make one proselyte, and when he is made, ye make him twofold more the child of hell than yourselves.",47
Matthew,23,16,"Woe unto you, ye blind guides, which say, Whosoever shall swear by the temple, it is nothing; but whosoever shall swear by the gold of the temple, he is a debtor!",20
Matthew,23,17,"Ye fools and blind: for whether is greater, the gold, or the temple that sanctifieth the gold?",20
Matthew,23,18,"And, Whosoever shall swear by the altar, it is nothing; but whosoever sweareth by the gift that is upon it, he is guilty.",20
Matthew,23,19,"Ye fools and blind: for whether is greater, the gift, or the altar that sanctifieth the gift?",20
Matthew,23,20,"Whoso therefore shall swear by the altar, sweareth by it, and by all things thereon.",47
Matthew,23,21,"And whoso shall swear by the temple, sweareth by it, and by him that dwelleth therein.",47
Matthew,23,22,"And he that shall swear by heaven, sweareth by the throne of God, and by him that sitteth thereon.",47
Matthew,23,23,"Woe unto you, scribes and Pharisees, hypocrites!",21
Matthew,23,23,"for ye pay tithe of mint and anise and cummin, and have omitted the weightier matters of the law, judgment, mercy, and faith: these ought ye to have done, and not to leave the other undone.",10
Matthew,23,24,"Ye blind guides, which strain at a gnat, and swallow a camel.",10
Matthew,23,25,"Woe unto you, scribes and Pharisees, hypocrites!",21
Matthew,23,25,"for ye make clean the outside of the cup and of the platter, but within they are full of extortion and excess.",43
Matthew,23,26,"Thou blind Pharisee, cleanse first that which is within the cup and platter, that the outside of them may be clean also.",10
Matthew,23,27,"Woe unto you, scribes and Pharisees, hypocrites!",21
Matthew,23,27,"for ye are like unto whited sepulchres, which indeed appear beautiful outward, but are within full of dead men's bones, and of all uncleanness.",43
Matthew,23,28,"Even so ye also outwardly appear righteous unto men, but within ye are full of hypocrisy and iniquity.",43
Matthew,23,29,"Woe unto you, scribes and Pharisees, hypocrites!",21
Matthew,23,29,"because ye build the tombs of the prophets, and garnish the sepulchres of the righteous,",10
Matthew,23,30,"And say, If we had been in the days of our fathers, we would not have been partakers with them in the blood of the prophets.",10
Matthew,23,31,"Wherefore ye be witnesses unto yourselves, that ye are the children of them which killed the prophets.",43
Matthew,23,32,Fill ye up then the measure of your fathers.,10
Matthew,23,33,"Ye serpents, ye generation of vipers, how can ye escape the damnation of hell?",10
Matthew,23,34,"Wherefore, behold, I send unto you prophets, and wise men, and scribes: and some of them ye shall kill and crucify; and some of them shall ye scourge in your synagogues, and persecute them from city to city:",30
Matthew,23,35,"That upon you may come all the righteous blood shed upon the earth, from the blood of righteous Abel unto the blood of Zacharias son of Barachias, whom ye slew between the temple and the altar.",10
Matthew,23,36,"Verily I say unto you, All these things shall come upon this generation.",24
Matthew,23,37,"O Jerusalem, Jerusalem, thou that killest the prophets, and stonest them which are sent unto thee, how often would I have gathered thy children together, even as a hen gathereth her chickens under her wings, and ye would not!",17
Matthew,23,38,"Behold, your house is left unto you desolate.",10
Matthew,23,39,"For I say unto you, Ye shall not see me henceforth, till ye shall say, Blessed is he that cometh in the name of the Lord.",2
Matthew,24,2,See ye not all these things?,1
Matthew,24,2,"verily I say unto you, There shall not be left here one stone upon another, that shall not be thrown down.",19
Matthew,24,4,Take heed that no man deceive you.,10
Matthew,24,5,"For many shall come in my name, saying, I am Christ; and shall deceive many.",8
Matthew,24,6,"And ye shall hear of wars and rumours of wars: see that ye be not troubled: for all these things must come to pass, but the end is not yet.",1
Matthew,24,7,"For nation shall rise against nation, and kingdom against kingdom: and there shall be famines, and pestilences, and earthquakes, in divers places.",40
Matthew,24,8,All these are the beginning of sorrows.,43
Matthew,24,9,"Then shall they deliver you up to be afflicted, and shall kill you: and ye shall be hated of all nations for my name's sake.",19
Matthew,24,10,"And then shall many be offended, and shall betray one another, and shall hate one another.",47
Matthew,24,11,"And many false prophets shall rise, and shall deceive many.",47
Matthew,24,12,"And because iniquity shall abound, the love of many shall wax cold.",10
Matthew,24,13,"But he that shall endure unto the end, the same shall be saved.",19
Matthew,24,14,And this gospel of the kingdom shall be preached in all the world for a witness unto all nations; and then shall the end come.,33
Matthew,24,15,"When ye therefore shall see the abomination of desolation, spoken of by Daniel the prophet, stand in the holy place, (whoso readeth, let him understand:)",10
Matthew,24,16,Then let them which be in Judaea flee into the mountains:,10
Matthew,24,17,Let him which is on the housetop not come down to take any thing out of his house:,13
Matthew,24,18,Neither let him which is in the field return back to take his clothes.,13
Matthew,24,19,"And woe unto them that are with child, and to them that give suck in those days!",6
Matthew,24,20,"But pray ye that your flight be not in the winter, neither on the sabbath day:",44
Matthew,24,21,"For then shall be great tribulation, such as was not since the beginning of the world to this time, no, nor ever shall be.",33
Matthew,24,22,"And except those days should be shortened, there should no flesh be saved: but for the elect's sake those days shall be shortened.",10
Matthew,24,23,"Then if any man shall say unto you, Lo, here is Christ, or there; believe it not.",2
Matthew,24,24,"For there shall arise false Christs, and false prophets, and shall shew great signs and wonders; insomuch that, if it were possible, they shall deceive the very elect.",47
Matthew,24,25,"Behold, I have told you before.",30
Matthew,24,26,"Wherefore if they shall say unto you, Behold, he is in the desert; go not forth: behold, he is in the secret chambers; believe it not.",10
Matthew,24,27,"For as the lightning cometh out of the east, and shineth even unto the west; so shall also the coming of the Son of man be.",5
Matthew,24,28,"For wheresoever the carcase is, there will the eagles be gathered together.",10
Matthew,24,29,"Immediately after the tribulation of those days shall the sun be darkened, and the moon shall not give her light, and the stars shall fall from heaven, and the powers of the heavens shall be shaken:",10
Matthew,24,30,"And then shall appear the sign of the Son of man in heaven: and then shall all the tribes of the earth mourn, and they shall see the Son of man coming in the clouds of heaven with power and great glory.",5
Matthew,24,31,"And he shall send his angels with a great sound of a trumpet, and they shall gather together his elect from the four winds, from one end of heaven to the other.",47
Matthew,24,32,"Now learn a parable of the fig tree; When his branch is yet tender, and putteth forth leaves, ye know that summer is nigh:",49
Matthew,24,33,"So likewise ye, when ye shall see all these things, know that it is near, even at the doors.",1
Matthew,24,34,"Verily I say unto you, This generation shall not pass, till all these things be fulfilled.",24
Matthew,24,35,"Heaven and earth shall pass away, but my words shall not pass away.",48
Matthew,24,36,"But of that day and hour knoweth no man, no, not the angels of heaven, but my Father only.",38
Matthew,24,37,"But as the days of Noe were, so shall also the coming of the Son of man be.",5
Matthew,24,38,"For as in the days that were before the flood they were eating and drinking, marrying and giving in marriage, until the day that Noe entered into the ark,",10
Matthew,24,39,"And knew not until the flood came, and took them all away; so shall also the coming of the Son of man be.",5
Matthew,24,40,"Then shall two be in the field; the one shall be taken, and the other left.",15
Matthew,24,41,"Two women shall be grinding at the mill; the one shall be taken, and the other left.",15
Matthew,24,42,Watch therefore: for ye know not what hour your Lord doth come.,30
Matthew,24,43,"But know this, that if the goodman of the house had known in what watch the thief would come, he would have watched, and would not have suffered his house to be broken up.",47
Matthew,24,44,Therefore be ye also ready: for in such an hour as ye think not the Son of man cometh.,5
Matthew,24,45,"Who then is a faithful and wise servant, whom his lord hath made ruler over his household, to give them meat in due season?",47
Matthew,24,46,"Blessed is that servant, whom his lord when he cometh shall find so doing.",47
Matthew,24,47,"Verily I say unto you, That he shall make him ruler over all his goods.",2
Matthew,24,48,"But and if that evil servant shall say in his heart, My lord delayeth his coming;",10
Matthew,24,49,"And shall begin to smite his fellowservants, and to eat and drink with the drunken;",47
Matthew,24,50,"The lord of that servant shall come in a day when he looketh not for him, and in an hour that he is not aware of,",47
Matthew,24,51,"And shall cut him asunder, and appoint him his portion with the hypocrites: there shall be weeping and gnashing of teeth.",29
Matthew,25,1,"Then shall the kingdom of heaven be likened unto ten virgins, which took their lamps, and went forth to meet the bridegroom.",22
Matthew,25,2,"And five of them were wise, and five were foolish.",47
Matthew,25,3,"They that were foolish took their lamps, and took no oil with them:",47
Matthew,25,4,But the wise took oil in their vessels with their lamps.,10
Matthew,25,5,"While the bridegroom tarried, they all slumbered and slept.",10
Matthew,25,6,"And at midnight there was a cry made, Behold, the bridegroom cometh; go ye out to meet him.",47
Matthew,25,7,"Then all those virgins arose, and trimmed their lamps.",47
Matthew,25,8,"And the foolish said unto the wise, Give us of your oil; for our lamps are gone out.",10
Matthew,25,9,"But the wise answered, saying, Not so; lest there be not enough for us and you: but go ye rather to them that sell, and buy for yourselves.",10
Matthew,25,10,"And while they went to buy, the bridegroom came; and they that were ready went in with him to the marriage: and the door was shut.",47
Matthew,25,11,"Afterward came also the other virgins, saying, Lord, Lord, open to us.",8
Matthew,25,12,"But he answered and said, Verily I say unto you, I know you not.",2
Matthew,25,13,"Watch therefore, for ye know neither the day nor the hour wherein the Son of man cometh.",5
Matthew,25,14,"For the kingdom of heaven is as a man travelling into a far country, who called his own servants, and delivered unto them his goods.",22
Matthew,25,15,"And unto one he gave five talents, to another two, and to another one; to every man according to his several ability; and straightway took his journey.",47
Matthew,25,16,"Then he that had received the five talents went and traded with the same, and made them other five talents.",47
Matthew,25,17,"And likewise he that had received two, he also gained other two.",47
Matthew,25,18,"But he that had received one went and digged in the earth, and hid his lord's money.",47
Matthew,25,19,"After a long time the lord of those servants cometh, and reckoneth with them.",47
Matthew,25,20,"And so he that had received five talents came and brought other five talents, saying, Lord, thou deliveredst unto me five talents: behold, I have gained beside them five talents more.",8
Matthew,25,21,"His lord said unto him, Well done, thou good and faithful servant: thou hast been faithful over a few things, I will make thee ruler over many things: enter thou into the joy of thy lord.",17
Matthew,25,22,"He also that had received two talents came and said, Lord, thou deliveredst unto me two talents: behold, I have gained two other talents beside them.",8
Matthew,25,23,"His lord said unto him, Well done, good and faithful servant; thou hast been faithful over a few things, I will make thee ruler over many things: enter thou into the joy of thy lord.",17
Matthew,25,24,"Then he which had received the one talent came and said, Lord, I knew thee that thou art an hard man, reaping where thou hast not sown, and gathering where thou hast not strawed:",17
Matthew,25,25,"And I was afraid, and went and hid thy talent in the earth: lo, there thou hast that is thine.",17
Matthew,25,26,"His lord answered and said unto him, Thou wicked and slothful servant, thou knewest that I reap where I sowed not, and gather where I have not strawed:",17
Matthew,25,27,"Thou oughtest therefore to have put my money to the exchangers, and then at my coming I should have received mine own with usury.",47
Matthew,25,28,"Take therefore the talent from him, and give it unto him which hath ten talents.",47
Matthew,25,29,"For unto every one that hath shall be given, and he shall have abundance: but from him that hath not shall be taken away even that which he hath.",11
Matthew,25,30,And cast ye the unprofitable servant into outer darkness: there shall be weeping and gnashing of teeth.,29
Matthew,25,31,"When the Son of man shall come in his glory, and all the holy angels with him, then shall he sit upon the throne of his glory:",5
Matthew,25,32,"And before him shall be gathered all nations: and he shall separate them one from another, as a shepherd divideth his sheep from the goats:",47
Matthew,25,33,"And he shall set the sheep on his right hand, but the goats on the left.",47
Matthew,25,34,"Then shall the King say unto them on his right hand, Come, ye blessed of my Father, inherit the kingdom prepared for you from the foundation of the world:",33
Matthew,25,35,"For I was an hungred, and ye gave me meat: I was thirsty, and ye gave me drink: I was a stranger, and ye took me in:",30
Matthew,25,36,"Naked, and ye clothed me: I was sick, and ye visited me: I was in prison, and ye came unto me.",30
