book,chapter,verse,text
Matthew,26,31,"All ye shall be offended because of me this night: for it is written, I will smite the shepherd, and the sheep of the flock shall be scattered abroad."
Matthew,26,32,"But after I am risen again, I will go before you into Galilee."
Matthew,26,34,"Verily I say unto thee, That this night, before the cock crow, thou shalt deny me thrice."
Matthew,26,36,"Sit ye here, while I go and pray yonder."
Matthew,26,38,"My soul is exceeding sorrowful, even unto death: tarry ye here, and watch with me."
Matthew,26,39,"O my Father, if it be possible, let this cup pass from me: nevertheless not as I will, but as thou wilt."
Matthew,26,40,"What, could ye not watch with me one hour?"
Matthew,26,41,"Watch and pray, that ye enter not into temptation: the spirit indeed is willing, but the flesh is weak."
Matthew,26,42,"O my Father, if this cup may not pass away from me, except I drink it, thy will be done."
Matthew,26,45,"Sleep on now, and take your rest: behold, the hour is at hand, and the Son of man is betrayed into the hands of sinners."
Matthew,26,46,"Rise, let us be going: behold, he is at hand that doth betray me."
Matthew,26,50,"Friend, wherefore art thou come?"
Matthew,26,52,"Put up again thy sword into his place: for all they that take the sword shall perish with the sword."
Matthew,26,53,"Thinkest thou that I cannot now pray to my Father, and he shall presently give me more than twelve legions of angels?"
Matthew,26,54,"But how then shall the scriptures be fulfilled, that thus it must be?"
Matthew,26,55,"Are ye come out as against a thief with swords and staves for to take me? I sat daily with you teaching in the temple, and ye laid no hold on me."
Matthew,26,56,"But all this was done, that the scriptures of the prophets might be fulfilled."
Matthew,26,64,"Thou hast said: nevertheless I say unto you, Hereafter shall ye see the Son of man sitting on the right hand of power, and coming in the clouds of heaven."
Matthew,27,11,"Thou sayest."
Matthew,27,46,"My God, my God, why hast thou forsaken me?"
Matthew,28,9,"All hail."
Matthew,28,10,"Be not afraid: go tell my brethren that they go into Galilee, and there shall they see me."
Matthew,28,18,"All power is given unto me in heaven and in earth."
Matthew,28,19,"Go ye therefore, and teach all nations, baptizing them in the name of the Father, and of the Son, and of the Holy Ghost:"
Matthew,28,20,"Teaching them to observe all things whatsoever I have commanded you: and, lo, I am with you alway, even unto the end of the world. Amen."